{
  "$schema": "https://json-schema.org/draft/2020-12/schema",
  "$id": "lookout.card/1.0",
  "title": "Weatherdeck card, version 1.x",
  "description": "One small status card from one tool. Read-only data: the board never runs or imports the tool. Unknown fields are ignored. Also checked in code, not expressible here: updated_at must be a real calendar time and no more than 5 minutes in the future, and the major version of schema_version must be 1. See docs/ADDINS.md.",
  "type": "object",
  "required": ["schema", "schema_version", "tool", "title", "status", "headline", "updated_at"],
  "properties": {
    "schema": { "const": "lookout.card" },
    "schema_version": { "type": "string", "pattern": "^[0-9]{1,4}\\.[0-9]{1,4}$" },
    "tool": { "type": "string", "pattern": "^[a-z0-9][a-z0-9._-]{0,47}$", "description": "Stable id of the tool; one card per tool." },
    "title": { "type": "string", "minLength": 1, "maxLength": 60 },
    "status": { "enum": ["ok", "warn", "bad", "unknown"] },
    "headline": { "type": "string", "minLength": 1, "maxLength": 160, "description": "One line: what a person needs to know." },
    "numbers": {
      "type": "array",
      "maxItems": 6,
      "items": {
        "type": "object",
        "required": ["label", "value"],
        "properties": {
          "label": { "type": "string", "minLength": 1, "maxLength": 32 },
          "value": { "type": ["number", "string"], "maxLength": 32, "minimum": -1e15, "maximum": 1e15 },
          "unit": { "type": "string", "maxLength": 12 }
        }
      }
    },
    "link": { "type": "string", "pattern": "^https?://[^\\s<>\"']{1,500}$", "description": "Shown as text; the board never fetches it." },
    "updated_at": { "type": "string", "pattern": "^[0-9]{4}-[0-9]{2}-[0-9]{2}T[0-9]{2}:[0-9]{2}:[0-9]{2}(\\.[0-9]+)?Z$" },
    "mode": { "type": "string", "pattern": "^[a-z][a-z0-9-]{0,23}$", "description": "Optional operating mode, for example advice-only or live-repair." },
    "stale_after_s": { "type": "integer", "minimum": 60, "maximum": 604800, "description": "Seconds after updated_at when the board marks this card stale. Default: cards.stale_after_s in the config." }
  }
}
